{
  "$schema": "https://json-schema.org/draft/2020-12/schema",
  "$id": "urn:vt-budget:schema:registry:1.0",
  "title": "Entity registry",
  "description": "The canonical record of who exists: supervisory unions, member districts, schools and towns, with relationships and effective dates. Bitemporal-lite: when Act 170 mergers take effect the old entities do not disappear, they close, and their history stays queryable. One file per entity type, records sorted by slug, so a nightly sync produces readable per-record diffs.",
  "type": "object",
  "additionalProperties": false,
  "required": ["schema_version", "entity_type", "synced_from", "records"],
  "properties": {
    "schema_version": { "const": "1.0" },
    "entity_type": {
      "enum": ["su", "sd", "ud", "school", "town", "academy", "techcenter", "independent", "state"]
    },
    "synced_from": {
      "type": "object",
      "additionalProperties": false,
      "required": ["api", "endpoint", "last_synced"],
      "properties": {
        "api": { "type": "string", "format": "uri" },
        "endpoint": { "type": "string" },
        "last_synced": { "type": "string", "format": "date" },
        "snapshot": {
          "type": ["string", "null"],
          "description": "Path to the raw API response this sync was built from, under registry/raw/YYYY-MM-DD/.",
          "default": null
        }
      }
    },
    "records": {
      "type": "array",
      "items": { "$ref": "#/$defs/entity" }
    }
  },
  "$defs": {
    "entity": {
      "type": "object",
      "additionalProperties": false,
      "required": ["slug", "name", "type", "effective_from", "effective_to"],
      "properties": {
        "slug": {
          "$ref": "urn:vt-budget:schema:common:1.0#/$defs/entity_ref",
          "description": "Our stable internal ID. Assigned once and never changed, even when AOE renames or renumbers the entity."
        },
        "name": { "type": "string", "minLength": 1 },
        "type": {
          "enum": ["su", "sd", "ud", "school", "town", "academy", "techcenter", "independent", "state"]
        },
        "aoe_org_id": { "$ref": "urn:vt-budget:schema:common:1.0#/$defs/aoe_org_id" },
        "aoe_server_id": {
          "type": ["integer", "null"],
          "description": "The API's internal ServerId. Recorded for cross-referencing but never used as a key -- it is an implementation detail of their system.",
          "default": null
        },
        "edfi_id": { "type": ["number", "null"], "default": null },

        "effective_from": {
          "type": ["string", "null"],
          "format": "date",
          "description": "When this entity began. The AOE API publishes no opening date, so for entities first seen through the sync this is the date of the snapshot that first observed them, and `effective_from_basis` says so. Do not read it as an authoritative founding date."
        },
        "effective_from_basis": {
          "enum": ["statute", "aoe_published", "first_observed", "manual", "unknown"],
          "default": "unknown"
        },
        "effective_to": {
          "type": ["string", "null"],
          "format": "date",
          "description": "When this entity closed, from the CloseDate field on the AOE closed_organizations endpoint. Null means currently active."
        },
        "effective_to_basis": {
          "enum": ["statute", "aoe_published", "first_observed", "manual", "unknown"],
          "default": "unknown"
        },
        "successor": {
          "type": ["string", "null"],
          "description": "Slug of the entity that took over this one's territory or students. The AOE API publishes NO successor field -- every value here is hand-entered from statute or AOE guidance and must carry a note. This is the lineage the 2028-29 consolidation work depends on.",
          "default": null
        },
        "successor_basis": { "type": ["string", "null"], "default": null },

        "supervisory_union": {
          "type": ["string", "null"],
          "description": "Slug of the SU this entity belongs to.",
          "default": null
        },
        "operated_by": {
          "type": ["string", "null"],
          "description": "Slug of the district that operates this entity. NOTE: the AOE API's ParentOrg/OperatedBy fields carry inverted meanings between towns and schools -- for a town, ParentOrg is its union district and OperatedBy is its SU; for a school, ParentOrg is its SU and OperatedBy is its district. The sync untangles this; do not read the raw fields directly.",
          "default": null
        },
        "reporting_only": {
          "type": "boolean",
          "description": "True for AOE reporting buckets rather than real organizations -- a town record named UNKNOWN is how residency is recorded for pupils whose town is not established. These are kept because other records reference them, but no average daily membership is awarded to them: they contribute no weighted pupils, owe no budget in the coverage matrix, and cannot take part in a merger scenario. Recording it here keeps the constraint in the data rather than in the memory of whoever writes the next query.",
          "default": false
        },
        "member_towns": {
          "type": "array",
          "description": "Slugs of towns whose students this district serves. Populated for districts, empty for other types.",
          "items": { "$ref": "urn:vt-budget:schema:common:1.0#/$defs/entity_ref" },
          "default": []
        },
        "grades": {
          "type": "array",
          "items": { "type": "string" },
          "default": []
        },
        "website": { "type": ["string", "null"], "default": null },
        "latitude": { "type": ["number", "null"], "default": null },
        "longitude": { "type": ["number", "null"], "default": null },

        "grade_span": {
          "type": ["object", "null"],
          "additionalProperties": false,
          "required": ["low", "high"],
          "description": "Normalized integer form of `grades`, for schools. PK and EE map to -1, K to 0, grades 1-12 to themselves. The integer form exists so 'the nearest school of the same grade span' is a comparison rather than a string match; `grades` is kept verbatim beside it per the stated-versus-computed principle.",
          "default": null,
          "properties": {
            "low": { "type": "integer", "minimum": -1, "maximum": 12 },
            "high": { "type": "integer", "minimum": -1, "maximum": 12 },
            "as_stated": { "type": ["string", "null"], "default": null }
          }
        },
        "grade_span_class": {
          "type": ["string", "null"],
          "enum": ["elementary", "middle", "secondary", "elementary_middle", "middle_secondary", "combined", "other", null],
          "description": "Derived from grade_span. Selects the travel-time threshold in the small/sparse framework, which proposes 45 minutes one way for elementary pupils and 60 for grades 7-12. A span crossing that boundary -- K-8 and K-12, of which Vermont has many -- is ambiguous under the framework as drafted; the engine applies the stricter threshold and flags it rather than choosing the convenient one.",
          "default": null
        },
        "mailing_city": {
          "type": ["string", "null"],
          "description": "MailingCity as AOE publishes it. A POSTAL designation and not a municipality: Vermont post office names routinely cover parts of several towns. Recorded because it is what the source says, and never read as `municipality`.",
          "default": null
        },
        "municipality": {
          "type": ["string", "null"],
          "description": "Slug of the town, city or gore the school BUILDING stands in. Load-bearing for the sparse screen, which tests the density of the municipality where the school is located rather than of the district's member towns -- a school in a dense town inside an otherwise sparse district does not pass it. Null until established; the screen then declines to evaluate rather than guessing.",
          "default": null
        },
        "municipality_basis": {
          "enum": ["census_geocoder_point_in_polygon", "aoe_mailing_city", "manual", "unknown"],
          "description": "How `municipality` was established. `aoe_mailing_city` is recorded but is NOT sufficient for the density screen, because a postal city is not a municipality; the screen treats it as unestablished. `census_geocoder_point_in_polygon` resolves the published coordinates against Census county subdivisions and is sufficient.",
          "default": "unknown"
        },
        "geocode_precision": {
          "enum": ["rooftop", "parcel", "street", "municipality_centroid", "unknown"],
          "description": "Precision of latitude/longitude. `municipality_centroid` is not good enough to screen a 10-to-15-mile distance threshold, so the distance criterion returns indeterminate at that precision instead of estimating.",
          "default": "unknown"
        },
        "school_type": {
          "type": ["string", "null"],
          "enum": ["public", "approved_independent", "career_technical_center", "other", null],
          "description": "Only public schools are eligible for the Act 73 small and sparse support grants. Independent schools stay in the registry because they are receiving schools in consolidation scenarios and appear in the tuitioning limb of the necessity criteria.",
          "default": null
        },

        "aoe_published": {
          "type": "object",
          "description": "What AOE publishes for each field currently under correction, kept alongside the corrected value rather than reconciled with it. A field leaves this map the moment AOE adopts the correction. Written by the sync from registry/corrections.yaml; do not hand-edit.",
          "additionalProperties": true,
          "default": {}
        },
        "manual_overrides": {
          "type": "array",
          "description": "GENERATED from registry/corrections.yaml by the sync -- do not hand-edit. One entry per correction currently in force, with the evidence summarized in `reason`. Entries disappear when AOE adopts the correction.",
          "items": {
            "type": "object",
            "additionalProperties": false,
            "required": ["field", "reason", "set_by", "set_date"],
            "properties": {
              "field": { "type": "string" },
              "reason": { "type": "string", "minLength": 1 },
              "set_by": { "type": "string" },
              "set_date": { "type": "string", "format": "date" }
            }
          },
          "default": []
        },
        "notes": { "type": ["string", "null"], "default": null }
      }
    }
  }
}
