{
  "schema_version": "1.0",
  "entity_type": "academy",
  "synced_from": {
    "api": "https://datacollection.education.vermont.gov",
    "endpoint": "/api/lists/independentSchools",
    "last_synced": "2026-10-01",
    "snapshot": "registry/raw/2026-10-01"
  },
  "records": [
    {
      "slug": "academy/burr-and-burton-academy",
      "name": "BURR AND BURTON ACADEMY",
      "type": "academy",
      "aoe_org_id": "PA002",
      "aoe_server_id": 58,
      "edfi_id": null,
      "effective_from": "2026-07-29",
      "effective_from_basis": "first_observed",
      "effective_to": null,
      "effective_to_basis": "unknown",
      "successor": null,
      "successor_basis": null,
      "supervisory_union": null,
      "operated_by": null,
      "reporting_only": false,
      "member_towns": [],
      "grades": [
        "9",
        "10",
        "11",
        "12"
      ],
      "website": null,
      "latitude": 43.16414566,
      "longitude": -73.07736959,
      "grade_span": {
        "low": 9,
        "high": 12,
        "as_stated": "9,10,11,12"
      },
      "grade_span_class": "secondary",
      "mailing_city": "Manchester",
      "municipality": null,
      "municipality_basis": "unknown",
      "geocode_precision": "unknown",
      "school_type": "approved_independent",
      "manual_overrides": [],
      "notes": null
    },
    {
      "slug": "academy/lyndon-institute",
      "name": "LYNDON INSTITUTE",
      "type": "academy",
      "aoe_org_id": "PA003",
      "aoe_server_id": 59,
      "edfi_id": null,
      "effective_from": "2026-07-29",
      "effective_from_basis": "first_observed",
      "effective_to": null,
      "effective_to_basis": "unknown",
      "successor": null,
      "successor_basis": null,
      "supervisory_union": null,
      "operated_by": null,
      "reporting_only": false,
      "member_towns": [],
      "grades": [
        "9",
        "10",
        "11",
        "12"
      ],
      "website": null,
      "latitude": 44.5384112,
      "longitude": -72.0154517,
      "grade_span": {
        "low": 9,
        "high": 12,
        "as_stated": "9,10,11,12"
      },
      "grade_span_class": "secondary",
      "mailing_city": "Lyndon Center",
      "municipality": null,
      "municipality_basis": "unknown",
      "geocode_precision": "unknown",
      "school_type": "approved_independent",
      "manual_overrides": [],
      "notes": null
    },
    {
      "slug": "academy/st-johnsbury-academy",
      "name": "ST JOHNSBURY ACADEMY",
      "type": "academy",
      "aoe_org_id": "PA004",
      "aoe_server_id": 60,
      "edfi_id": null,
      "effective_from": "2026-07-29",
      "effective_from_basis": "first_observed",
      "effective_to": null,
      "effective_to_basis": "unknown",
      "successor": null,
      "successor_basis": null,
      "supervisory_union": null,
      "operated_by": null,
      "reporting_only": false,
      "member_towns": [],
      "grades": [
        "9",
        "10",
        "11",
        "12"
      ],
      "website": null,
      "latitude": 44.41656569,
      "longitude": -72.01933116,
      "grade_span": {
        "low": 9,
        "high": 12,
        "as_stated": "9,10,11,12"
      },
      "grade_span_class": "secondary",
      "mailing_city": "St Johnsbury",
      "municipality": null,
      "municipality_basis": "unknown",
      "geocode_precision": "unknown",
      "school_type": "approved_independent",
      "manual_overrides": [],
      "notes": null
    },
    {
      "slug": "academy/thetford-academy",
      "name": "THETFORD ACADEMY",
      "type": "academy",
      "aoe_org_id": "PA005",
      "aoe_server_id": 61,
      "edfi_id": null,
      "effective_from": "2026-07-29",
      "effective_from_basis": "first_observed",
      "effective_to": null,
      "effective_to_basis": "unknown",
      "successor": null,
      "successor_basis": null,
      "supervisory_union": null,
      "operated_by": null,
      "reporting_only": false,
      "member_towns": [],
      "grades": [
        "7",
        "8",
        "9",
        "10",
        "11",
        "12"
      ],
      "website": null,
      "latitude": 43.81456547,
      "longitude": -72.23165622,
      "grade_span": {
        "low": 7,
        "high": 12,
        "as_stated": "7,8,9,10,11,12"
      },
      "grade_span_class": "middle_secondary",
      "mailing_city": "Thetford Center",
      "municipality": null,
      "municipality_basis": "unknown",
      "geocode_precision": "unknown",
      "school_type": "approved_independent",
      "manual_overrides": [],
      "notes": null
    }
  ]
}
